title,location,department,salary_range,company_profile,description,requirements,benefits,telecommuting,has_company_logo,has_questions,employment_type,required_experience,required_education,industry,function,fraudulent
Project Subcontracting Manager,"US, TX, Houston",Project Management,null,null,"Corporate overviewAker Solutions is a global provider of products, systems and services to the oil and gas industry. Our engineering, design and technology bring discoveries into production and maximize recovery from each petroleum field. We employ approximately 28,000 people in about 30 countries. Go to #URL_0fa3f7c5e23a16de16a841e368006cae916884407d90b154dfef3976483a71ae# for more information on our business, people and values.We are looking for individuals who are prepared to take a position. Not only a position within Aker Solutions, but also a position on the exciting challenges the global oil and gas industry faces now and in the futureAker Solutions are looking to recruit a Project Subcontracting Manager to be based in their Houston office, USA.We are currently expanding and we need new talents who can strengthen our team and support our ambitious plans within the subsea market.Responsibilities and tasks- Overall responsibility for management of the Joint Venture (JV) its contracts ie. management of subcontracts and own fabrication and test activities at service base in the country/region of execution. - Promote HSE and quality mindset, on-time delivery, co-operation, proactive- and resolution oriented mindset and continuous improvement. - To participate in the project from System Definition phase and heavily engaged during Detailing &amp; Fabrication, Assembly and Integration test phases. - Is part of the Project Management Team and is jointly accountable for achieving the project objectives (budget, scope, time schedule and quality).Execution overall - Managing all resources being part of the JV as well as all subcontracting/site teams- Participate on Tender teams when bidding on new SPS / MSP projects - Review ITT and determine client requirements for Local content and hence subcontracting- Establish project specific Terms &amp; Conditions for Purchase Orders to subcontractors when required, including LCI requirements- Prepare and negotiate any MOU and contracts with potential partners/subcontractors/local suppliers as part of BD/tendering activities and as part of project execution- Reviewing and analysing subcontractors/local supplier quotations as required- Managing the contracts towards local suppliers/subcontractors wrt scope, time, cost and qualityExecution at site(s);- Ensure timely delivery from product areas deliveries, including engineering documents and HW for local content execution- Ensure timely handling of any deviations- Is authorized to take and implement necessary decisions to ensure efficient performance construction and testing - Ensure mechanical completion on site- Ensure development of final documentation- Coordinate on site to facilitate for system integration testing (SIT)- Ensure required tooling is available for testing - Ensure SLS (local service base) participation in the project from System Definition phase including a proper handover- Ensure proper tidying up and handling of the test EQ, remained stock at site at the end of the project Scope Management- Report to the Project Management Core Team on any contractual or commercial issues related to sub-contractors- Prepare a list of necessary commercial and contractual qualifications for inclusion in tenders/projects for subcontract amendments or variation- Ensure that the fabrication is in accordance with the design- Assist in claims management and claims resolutionTime Management- Coordinate supplies to site (CPI/free issued items), fabrication and testing activities- Overlook fabrication, manufacturing and testing activities to ensure timely deliveriesQuality Management- Review quality plans for internal and subcontracted fabrication and follow up fabrication sites for proper implementation Communication Management- Ensure efficient communication between the project and manufacturing sites- Report progress on construction, fabrication and testing activitiesHSE Management- Provide feedback and supervise HSE plans since early in the project- Coordinate and monitor HSE requirements during construction and testing to ensure top HSE standards- Ensure on site HSE activities/actions (participate and document SJA, regular and ad-hoc inspections, train SIT team, handle SIT ""visitors"", get photo permissions for SIT resources etc)Corporate overviewAker Solutions is a global provider of products, systems and services to the oil and gas industry. Our engineering, design and technology bring discoveries into production and maximize recovery from each petroleum field. We employ approximately 28,000 people in about 30 countries. Go to #URL_0fa3f7c5e23a16de16a841e368006cae916884407d90b154dfef3976483a71ae# for more information on our business, people and values.We are looking for individuals who are prepared to take a position. Not only a position within Aker Solutions, but also a position on the exciting challenges the global oil and gas industry faces now and in the futureAker Solutions are looking to recruit a Project Subcontracting Manager to be based in their Houston office, USA.We are currently expanding and we need new talents who can strengthen our team and support our ambitious plans within the subsea market.Responsibilities and tasks- Overall responsibility for management of the Joint Venture (JV) its contracts ie. management of subcontracts and own fabrication and test activities at service base in the country/region of execution. - Promote HSE and quality mindset, on-time delivery, co-operation, proactive- and resolution oriented mindset and continuous improvement. - To participate in the project from System Definition phase and heavily engaged during Detailing &amp; Fabrication, Assembly and Integration test phases. - Is part of the Project Management Team and is jointly accountable for achieving the project objectives (budget, scope, time schedule and quality).Execution overall - Managing all resources being part of the JV as well as all subcontracting/site teams- Participate on Tender teams when bidding on new SPS / MSP projects - Review ITT and determine client requirements for Local content and hence subcontracting- Establish project specific Terms &amp; Conditions for Purchase Orders to subcontractors when required, including LCI requirements- Prepare and negotiate any MOU and contracts with potential partners/subcontractors/local suppliers as part of BD/tendering activities and as part of project execution- Reviewing and analysing subcontractors/local supplier quotations as required- Managing the contracts towards local suppliers/subcontractors wrt scope, time, cost and qualityExecution at site(s);- Ensure timely delivery from product areas deliveries, including engineering documents and HW for local content execution- Ensure timely handling of any deviations- Is authorized to take and implement necessary decisions to ensure efficient performance construction and testing - Ensure mechanical completion on site- Ensure development of final documentation- Coordinate on site to facilitate for system integration testing (SIT)- Ensure required tooling is available for testing - Ensure SLS (local service base) participation in the project from System Definition phase including a proper handover- Ensure proper tidying up and handling of the test EQ, remained stock at site at the end of the project Scope Management- Report to the Project Management Core Team on any contractual or commercial issues related to sub-contractors- Prepare a list of necessary commercial and contractual qualifications for inclusion in tenders/projects for subcontract amendments or variation- Ensure that the fabrication is in accordance with the design- Assist in claims management and claims resolutionTime Management- Coordinate supplies to site (CPI/free issued items), fabrication and testing activities- Overlook fabrication, manufacturing and testing activities to ensure timely deliveriesQuality Management- Review quality plans for internal and subcontracted fabrication and follow up fabrication sites for proper implementation Communication Management- Ensure efficient communication between the project and manufacturing sites- Report progress on construction, fabrication and testing activitiesHSE Management- Provide feedback and supervise HSE plans since early in the project- Coordinate and monitor HSE requirements during construction and testing to ensure top HSE standards- Ensure on site HSE activities/actions (participate and document SJA, regular and ad-hoc inspections, train SIT team, handle SIT ""visitors"", get photo permissions for SIT resources etc)","Qualifications &amp; personal attributes- MSc. in Engineering or/and Business Administration- 10 years’ experience from international Oil &amp; Gas or infrastructure industries as lead construction position- 3 years’ experience with handling of contractual issues within engineering and construction projects for offshore and subsea applications - Fundamental knowledge of; contract drafting, negotiating, background law, and business norms for Aker Subsea and Aker Solutions’ Contract Standards - Basic understanding of ERP systems, preferably SAP- Basic understanding of planning tools, preferably Primavera- Good communication and leadership skills- Good knowledge of the English language- Systematic and analytical - High integrity and ethical values- Ability to work both operationally and strategically- Flexibility on travelling and stationing/rotation required according to the project’s needs.",We offer• Friendly colleagues in an industry with a bright future.• An environment where you are encouraged to develop your skills and share your knowledge with your colleagues.• Competitive benefits and strong focus on work-life balance.,0,0,0,null,null,null,Oil & Energy,Project Management,1
Student Positions Part-Time and Full-Time.,"US, CA, Los Angeles",null,null,null,"Student Positions Part-Time and Full-Time.You can do it all from home, in your free time, at your own place.Spend 30 minutes or 1 hours a day &amp; Get biggest cash.You can work in the morning, afternoon, or at night.Perfect for everyone then start immediately.Can earn $350 to $450 extra per day.No any experience required.Zero start-up fee, Visit here:-#URL_7ebe37f71633be1b80547d6f213cb0075a63b6ced35281bfa5c067b5c685f04c#-rg.info",null,null,0,0,0,Part-time,null,null,null,null,1
Customer Success District Manager,"US, MO, St. Louis",null,null,"Aptitude Staffing Solutions has redesigned the recruiting wheel. Our innovative new platform cuts the recruiting time in half, yields scientifically-proven results and clients and candidates enjoy a pleasant experience through advanced, simple to use technology and a tenured, industry-experienced recruiting team. Join us in a fresh new experience of leveraging your career...the way it should be! All represented candidates enjoy the following perks:Expert negotiations, maximizing total compensation package Signing bonus by Aptitude Staffing in addition to client signing bonus (if applicable)1 Year access to AnyPerkRelocation Services for out of town candidatesContinued education in your area of profession, seminars, workshops and other skill development events Contract employees receive quarterly bonuses for the duration of their project Direct-Hire employees receive double bonues ($2,000) per referred/recruited candidate into their newly appointed companyAll candidates are encouraged to participate in our Referral Bonus Program &amp; earn $500 - $1,000 per hired referral            ","This company’s mission is to help the entire world’s people and businesses manage and adapt to climate change.The company is focused on helping farmers protect and increase their profits in the face of increasingly extreme weather.  At the heart is their unique Climate Insights™ technology platform, which encompasses their core competencies across weather monitoring, agronomic modeling, and weather simulation.  This platform powers the company’s portfolio of technology-based products and services, which are revolutionizing agricultural risk management and farm management. Leaving a mark on the world is their goal and making a lasting and meaningful real-world impact.  They relish big problems because they are the most interesting to tackle, the most rewarding, and typically, the most valuable to solve, and also thrive on finding the possible in the impossible. If you are the best at what you do, you like solving interesting problems, and you are looking for like-minded people dedicated to having a major impact on the world, we are eager to talk with you. Responsibilities: Job Responsibilities: This person would help users get started with a suite of online decision support tools and form relationships with large clients in their region so they can provide primary support for those clients and ensure customer satisfaction with the product.  Initial duties will focus on working with growers to set up the mechanics of the service and onboarding and training growers both in person and via phone calls and webinars.  This person will play a key role in helping clients understand the underlying agronomic principles that are guiding the field-specific recommendations that are generated by the company’s service.  Industry knowledge, a focus on customer service, and flexibility are critical.Onboard, all professional users in the territory;perform in-person orientations for large growers.Work with sales to ensure the onboarding of a new client is timely and seamless.Train users on the company overall, and then follow-up throughout the season to ensure the user is taking full advantage of all of the recommendations coming out of the service.Provide technical and agronomic support to users, as requested.Work with Product Marketing to create feature description videos that augment, in person, training and support.Work with Sales Support and Product and Product Marketing to provide product and feature feedback from interactions with users.",Skills and Requirements: Bachelor’s degree.Production ag experience in corn or soybeans and/or agronomy degree.Tech savvy.Advanced organizational skills and very detail oriented.Ability to deal with competing priorities and multi-task while juggling a high volume of inquiries.Excellent verbal skills and comfortable with web and mobile technology.Comfortable working in a rapidly changing environment.Ability to work independently.Willingness to travel.,"What We Offer: We offer the opportunity to join a high-powered team with a great company culture, solving a big real-world problem.  Our team is composed of some of the brightest interdisciplinary minds in the industry.  The environment is extremely engaging and fast-paced, with dozens of specialties coming together to provide the best possible products and experiences for our customers.In addition to great colleagues and engaging work, we offer competitive salary, excellent benefits, and some of the best perks in the industry, including:Energetic idea-driven work environment with an exciting culture.Exciting world-changing opportunity - we are solving problems that have a massive impact on the world.A driven, talented team that aims to make a large-scale impact through an innovative technology platform.",0,1,1,Full-time,Mid-Senior level,Bachelor's Degree,Information Technology and Services,Business Development,1
Mobile Developer-Back End,"US, WA, Seattle",Information Technology,null,"Climate Corporation and Aptitude Staffing Solutions have partnered up in an effort to streamline the hiring process and provide a more efficient and effective recruitng model.  Our focus is to help develop and achieve your career goals while makeing a solid geographical, cultural and professional fiit when leveraging your career into your new and exciting professional venture!","Managing over 200 TB of data, including 34 trillion+ weather simulation data points, 150 billion soil type observations, and more than   3 million daily weather measurements, we are one of the largest users of Amazon Web Services.Today we are focused on helping farmers protect and increase their profits in the face of increasingly extreme weather.  At the heart of the company is our unique technology platform, which encompasses our core competencies across weather monitoring, agronomic modeling, and weather simulation, and accounts for over 200 TB of data, including 34 trillion+ weather simulation data points, 150 billion soil type observations, and more than 3 million daily weather measurements.  This platform powers the company’s portfolio of technology-based products and services, which are revolutionizing agricultural risk management and farm management. We are leaving a mark on the world in our DNA; we want to make a lasting and meaningful real-world impact.  We relish big problems because they are the most interesting to tackle, the most rewarding, and typically the most valuable to solve.  We also thrive on finding the possible in the impossible.If you are the best at what you do, you like solving interesting problems, and you are looking for like-minded people dedicated to having a major impact on the world, we are eager to talk with you.Mobile Developer - Back EndWe are looking for experienced Ruby developers to join our engineering team, focusing on building back end support for the development of mobile applications for growers.What You Will Do:Write highly scalable and robust RESTful APIs to empower our mobile applications.Work closely with the iOS and Android team to ensure seamless integration with the back end.Opportunity to learn new technologies and frameworks.  ","What You Offer:Experience in writing clean and idiomatic Ruby code.Familiarity with the OOP and design patterns.A passion for clean and testable codeDetail orientation and strong collaboration skillsFamiliarity with CS fundamentals - a BS or MS in CS or equivalentWillingness to rapidly iterate and build out our application suite Bonus Points:Past experience with Test Driven or Behavior Driven Development.Some significant open source contribution.Past experience with JRuby, EventMachine, Ruby Fibres, Sinatra. ","What We Offer:Our team is composed of some of the most brilliant interdisciplinary minds in the industry. The environment is extremely engaging and fast-paced, with dozens of specialties coming together to provide the best possible product and experience for our customers.Competitive salary, excellent benefits, and some of the best perks in the industry, including:We provide meals and a large assortment of snacks, drinks, fruits, coffees, and teas to help you get through the day.We let you explore personally compelling topics by occasionally taking time to work on independent projects and contributing the results back to the open source community. Company sponsored outings, including go-kart races, kayaking, holiday yacht parties, and sporting events, etc.We sponsor hackathons, meetup groups, networking events, tech-talks, and conference trips. If you want to get involved in the tech community, we'll support your efforts. We encourage all employees to better understand our customers by getting out of the office and hearing firsthand from the agents and farmers our products serve.Energetic idea-driven work environment with an exciting culture.Exciting world-changing opportunity - we are solving problems that have a massive impact on the world!A driven, talented team that aims to make a large-scale impact through an innovative technology platform. ",0,1,0,Full-time,Mid-Senior level,Bachelor's Degree,Information Technology and Services,Information Technology,1
Sales Manager - General Trade,"ID, JW, Jakarta",Arc Int.,500000000-800000000,"Local expertise with an international perspective.Want to do more than just get from point A to point B?Bridging gaps, solving problems, creating smooth transitions. Excelling through experience and intelligence, knowledge and innovation. At each step, thinking outside of the box, around the box, about the box. One part local, one part international, and one part pure guts.Multi-talented – a star of all trades. Taking the “artificial” out of “artificial intelligence” and replacing it with creativity, zeal and a need to succeed.Tech-savvy. An arsenal of tools specially created for the recruitment process …and the smarts to use them. A source not of automatons or cookie-cutter moulds but of people – people with faces, names, personalities and the right stuff for the job.Driven yet conscientious. Passionate yet reputable. Pushing the standards of the recruitment industry to be better. Placing the right people in the right places. Specializing in executives and beyond. Envisioning solutions for the short and long term. This is why they come back for more.","Client - ARC InternationalArc International is a French manufacturer and distributor of household goods. The company was established in Arques, Pas-de-Calais, where it is still headquartered, as a glass-making firm under the name Verrerie des Sept Ecluses in 1825. In 1892 the name was changed to Verrerie Cristallerie d'Arques, and after a series of acquisitions in the 1990s the group was renamed in 2000 to the current name. It is the leading manufacturer of crystal and glassware in the world. It is privately held and has been owned by members of the Durand family since 1916. Arc International currently licenses the Pyrex brand of cookware for sale in the European Union. Competitors include Lenox Group, World Kitchen, and Waterford Wedgwood.Position - Sales Manager - General Trade &amp; Food ServicesBased locally and reports to the Country Manager.Main responsibility is to implement and control sales and marketing policies and execution along with the corporate strategy.Has to meet and to exceed the forecasted sales figures, to meet with margins expectations and to realise the qualitative targets agreed with the manager.Responsible for all the sales and marketing initiatives in view of increasing our sales, market share and brand awareness within all the potential distribution networks and for all our brands in portfolio.",Driven and result orientedStrong in leadership and people developmentHaving a business sense and strong in sales especially in General Trade &amp; Food ServicesCommunicate well in EnglishComing from FMCG and other related industry,TBA,0,1,0,Full-time,Mid-Senior level,Bachelor's Degree,Consumer Goods,Sales,0
