title,location,department,salary_range,company_profile,description,requirements,benefits,telecommuting,has_company_logo,has_questions,employment_type,required_experience,required_education,industry,function,fraudulent
Need a .net developer,"US, TX, plano",null,null,"Infolob Solutions is a leader in Managed IT services, Enterprise Application Software, IT staffing and Consulting and Application Portfolio Management. When we envisioned that the future IT consulting company we wanted to blend service, and technology to deliver measurable business results for our customers. We founded the company in 2009, and our team is composed of highly qualified and devoted professionals, with diverse backgrounds, creating a powerful mix of high quality specialists dedicated to providing our customers with one of the best products in the industry.","Duration: 4+ month contractLocation: Plano, TXRate: $50-55 maxTop Three Skills: 1. NET2. SQL3. SOA Job Description:This resource will be brought on to do new development on an application used by internal and external customers of Interface. One application would be the ISS portal. This portal creates an interface for the external customers of Interface to view their existing plans and easily access their account and security options.The second application is an application that will help Interface better forecast an implementation they are doing for Family Dollar. This application will enable them to implement up to 1000 sites per month.This new application will be built on C# and SQL utilizing SOA principles. Hours - 9-6 but flexible.Candidates should be energetic and willing to learn.","Business Challenge: They need to create one comprehensive application that will aggregate information from multiple points into a seamless portal for internal and external use. EVP: Opportunity to work for an industry leader and endless room for advancement. Non-Technical Skills: -Must be dependable, analytical, accurate and detail oriented- Must have excellent verbal and written communication skills Why is position open?: The current developers are focused on support of the legacy CRM system. They need new developers to come in and deliver on the new applications. Project Stage/Lifecycle Info: Technical Environment: C#, .net, SQL",null,0,1,0,Full-time,null,null,Computer Software,Information Technology,0
URGENT Full & Part Time Workers Needed.,"AU, NSW, Sydney",null,null,null,URGENT Full &amp; Part Time Workers Needed.No Experience Required And Never Any Fees.Work Anytime 1 To 2 Hrs Daily In Free Time.Earn Easily $400 To $500 Extra Per Day.Totally Free To Join &amp; Suitable For All.Take Action &amp; Get Started Here:-#URL_3642a95d0b2308884802999b8ba4f004b69950c970d00995af84c2270b7b570c#,No Experience Required And Never Any Fees.,Totally Free To Join &amp; Suitable For All.,0,0,0,Part-time,null,null,null,null,1
Field Service Tech Capital Equipment    1970,"US, NY, New York City",null,null,null,"1970Job Title: Field Service Tech Capital EquipmentRole: Technician / MaintenanceRelocation Available: No, must reside in target territoryIndustry: ManufacturingLocation: New YorkTown / City: New York CityJob Type: Permanent full-timeJob description:Leading capital equipment company is seeking Field Service Technicians.  The field service experience needs to be with food manufacturing equipment, material handling, high speed packaging equipment or similar. Responsibilities:*           Set-up, service, troubleshoot, and repair equipment at customers' facilities*           Install enhancements, test, and calibrate to meet our customers' specific needs*           Visit plants, make courtesy calls, and provide Customer trainingRequirements of the positions:*           Ability to travel, work independently and be flexible regarding frequent changes in schedule.*           ""Hands on"" Electro-Mechanical experience with pneumatics, hydraulics, AC/DC motor control, PLC's, Servo Systems*           Excellent customer relations skills including the ability to explain and train. *           AS Degree in Electronics, or equivalent experience*           Prior Field Service Experience and ability to speak Spanish*           Good written and verbal communication skills.  *           Computer skills in Microsoft offerings.Bottom Line Requirements:1.  Electro-Mechanical Field Service experience on capital machinery with pneumatics, hydraulics, AC/DC motor control, PLC's, Servo Systems.2.  Excellent customer relations skills including the ability to explain and train. 3.  AS Degree in Electronics, or equivalent experience4.  Field Service experience in the target territory.5.  Bilingual English - Spanish.","Bottom Line Requirements:1.  Electro-Mechanical Field Service experience on capital machinery with pneumatics, hydraulics, AC/DC motor control, PLC's, Servo Systems.2.  Excellent customer relations skills including the ability to explain and train. 3.  AS Degree in Electronics, or equivalent experience4.  Field Service experience in the target territory.5.  Bilingual English - Spanish.",null,0,0,0,Full-time,null,null,null,null,1
Network Marketing,"US, FL, ",null,7200-1380000,null,"Are you looking to make anywhere from 600-115,000$ a month? Are you looking to be paid to take vacations? Are you tired of working a 9-5 with no ability to grow in your field. Do you want to be your own boss and set your own schedule of when you work? If you answer yes to any of these than we have the perfect opportunity for you. Our company is based on 3 principles 1.Saving Money 2.Making Money 3.Managing Money. We offer financial soulutions to help you live financially free while making money showing others. We have over 5,800 national brand retailers where we recieve discounts.","An ambition to succeed, A desire to be the best at our field and not be discourage when people turn you down. If you have these qualities than you are perfect for this business","Residual Income, Travel dollars, Car Dollars, the ability to rise in pay grade rapidly as long as you put in the work you will see results",0,0,0,Full-time,Not Applicable,Unspecified,Marketing and Advertising,Advertising,1
Process Improvement Project Engineering Manager,"US, MO, St. Louis",null,null,"We Provide Full Time Permanent Positions for many medium to large US companies. We are interested in finding/recruiting high quality candidates in IT, Engineering, Manufacturing and other highly technical and non-technical jobs.","(We have more than 1500+ Job openings in our website and some of them are relevant to this job. Feel free to search it in the website and apply directly. Just Click the “Apply Now” and you will redirect to our main website where you can search for the other jobs.)EDUCATION: Bachelor’s degree in Industrial Engineering or related discipline; MBA preferred.REQUIRED SKILLS:6+ years of Process Improvement / Industrial Engineering;Must have Lean experience in a distribution center environment, Black Belt preferred;Strong operations knowledge of distribution and related processes;Leadership experience including the ability to manage a team of IE’s and drive value added change;",null,null,0,0,0,Full-time,null,null,null,null,0
Technical & Customer Support Associates,"US, PA, Philadelphia",CSA REP,23000-32000,"The Accion  story began more than 100 years ago in the Austin,Tx with one family owned establishment. Today, Accion  has grown into a nationwide Organazation with over 260 stores. Accion success is attributed to our unique niche in the market offering current   finance option at competitive prices paired with customer service and a personal shopping experience. Join the Accion story today!","Interface with customers via inbound or outbound calls or the Internet for the purpose of resolving routine problems with products or services.Greet customers in a courteous, friendly, and professional manner using agreed upon procedures.Listen attentively to customer needs and concerns; demonstrate empathyClarify customer requirements; probe for and confirm understanding of requirements or problemMeet customer requirements through first contact resolutionConfirm customer understanding of the solution and provide additional customer education as neededPrepare complete and accurate work and update customer fileCommunicate effectively with individuals/teams in the program to ensure high quality and timely expedition of customer requestsEffectively transfer misdirected customer requests to an appropriate party. Contribute ideas on ways to resolve problems to better serve the customer and/or improve productivityParticipate in activities designed to improve customer satisfaction and business performanceOccasionally use decision-support tools to answer questionsSolve problems that are sometimes unstructured and that may require reliance on conceptual thinkingOffer solutions to issues that are often non-standard/non-routine and require some clarificationMaintain broad knowledge of client products and services","Knowledge of basic computer operationsWillingness to rotate shifts, as neededAbility to learnCourteous with strong customer service orientationDependable with proficient attention to detailMust be flexible with the ability to adapt to changes quickly and think conceptuallyPossess insight into self and othersSolid problem solving skillsSome technical knowledgeExcellent Customer Service SkillsStrong written, verbal and organization skillsSuperior time management and prioritization skillsProficiency with navigating through multiple systemsTyping skillsExcellent listening and responding skillsAbility to learn on the fly, listen and apply problem solving skillsMinimum of High School Diploma / GED",Excellent BenefitsStrong Performance IncentivesExceptional Growth OpportunityIndustry Leading TrainingInbound Calls Only,0,1,1,Full-time,Associate,High School or equivalent,Financial Services,Customer Service,1
Director of Rehab,"US, CA, West Covina",null,null,"Welcome to interface rehabinterface rehab provides comprehensive rehabilitation (Physical, Occupational &amp; Speech Therapy) &amp; consultation services on a long term contractual basis to the various medical settings throughout Southern California.","                                                                         Job Summary:                                                                        Job Summary: The Director of Rehabilitation Directs and coordinates the policies, objectives, initiatives, and programs for the delivery of rehabilitation therapy programs to patients. Oversees the performance of the rehabilitation therapy staff, business planning and budget development. Assure services are in compliance with professional and clinical competency standards, state and federal regulatory requirements. Performs a variety of complicated tasks. Leads and directs the work of others. A wide degree of creativity and latitude is expected.The Director of Rehabilitation contributes to the accomplishment of Director of Rehabilitation practices and objectives that will provide a high performance culture that emphasizes empowerment, quality, productivity and standards, and goal attainment.                                                                         Organizational Relationships:                                                                        Reports to / Supervision Received: 1. Manager: Director of Operations 2. Direct Supervisor: Regional Mentor 3. Indirect Reporting Relationship: Head Coach                                                                         Essential Job Responsibilities:                                                                        Essential Functions: • Ability to apply facility's philosophy, principles and technology • Ability to demonstrate, and provide examples of, continuous personal development and improvement in each of the essential o Functions listed in the section below: o The ability to manage employees o Effective communication skills (verbal and written) o Ability to make independent decisions after gathering information from internal and external sources o A customer service-focused attitude. • Communicate with the referring physician and other professionals regarding patient's treatment program. • Perform initial patient evaluations and evaluates response to treatment interventions. • Understands and follows the regulatory statutes and rules to the practice of rehabilitation services. • Educates patients, family and staff as appropriate. • Familiarity with budgeting principles and procedures • Develops and manages the rehabilitation department that includes workstation inspections and assessment. • Provide in-service training related to rehabilitation service to staff and new employees. • Maintain progress notes and treatment plans on patient's treatment or referrals. • Supervise and mentor therapy programs. • Communicate effectively and proactively with physicians. • Develop and maintain positive relationships with physicians, external and internal customers. • Provide relevant program knowledge, analytical leadership, administrative guidance and advice in the day-to-day management of therapy programs. • Apply professional judgment in solving difficult issues. • Understand and work to meet and exceed the patient needs. • Communicate respectfully, openly, honestly and directly. • Promote an environment that facilitates innovation, creative solutions and empowerment. • Manage department in accordance with state law. • Coordinate strategic planning for therapy services. • Comply and enforce established policy and procedures for rehabilitation services. • Assist with recruitment for rehabilitation department. • Actively participate in all facility meetings-Stand Up/PPS. • Responsible for PPS management. • Coordinate D/C planning and equipment. • Participate in family conferences as needed. • Available for weekend coverage and scheduling as needed. • Must comply with company rules, policies and procedures • Must comply with safety rules, policies, and procedures • Assumes other duties as assigned.","Job Qualifications: 1. Licensed as a Physical Therapist, Speech-Language Pathologist, or Occupational Therapist for the State of California. 2. Must have a valid CPR certification 3. Must have a completed physical examination from a licensed physician. 4. Must have a negative TB skin test within the past year OR a clear Chest X-ray within the past five years.",Full Benefits,0,0,0,Full-time,Mid-Senior level,Certification,Hospital & Health Care,Health Care Provider,0
General Application,"US, , ",null,null,"MedTalent is a modern staffing company that specializes in the placement of physicians, nurses and healthcare professionals across the United States. For job updates follow us on Twitter and Facebook ",If you don't see a current opening that's a good fit but would still like to submit your resume for future opportunities please apply here. ,null,null,0,1,1,null,null,null,null,null,0
"Agency Sales Managers $150-$175,000/yr","US, NY, Finger Lakes",null,null,"We have aggressive growth plans in place for the coming years. We provide a much needed service in facilitating the growth of small and medium size business with innovative financing products to their clients.We, at Oak Tree Financing, commit our energies, intellect and knowledge to helping small and medium size business owners and entrepreneurs with extraordinary financing solutions to clients. We believe in providing the highest possible level of service and delivering superior results. We are committed to their financial well-being. With 67% of the population having No Credit or Bad Credit our financing products have helped business owners increase their sales on average by 30%.","We provide No Credit Check Financing to customers of Small and Medium size Businesses and can help 90% of the industries from Auto Mechanics to Dentists and Lawyers.We are seeking skilled Account Managers to grow with us and help us achieve our goals in this new and exciting industry.This is designed as a long-term position for an entrepreneurial individual to really build their book of business, along with their income.Our people enjoy a flexible work environment. High earnings with great incentives like corporate retreats and quick advancement opportunities.","Experience and Skills  Required- Minimum of 3 years of sales experience- Ability to work in a home office environment- Exceptional speaking, writing, and negotiation skills- You must be a motivated self starter and instil that others- College degree","We Provide- Complete online training and office support- Flexible working environment- An exciting and lucrative opportunity for those with a proven results background- Rapid advancement for those highly motivated- Average yearly income of $150-$175,000 based on our straight commission compensation model",0,1,0,Full-time,Associate,High School or equivalent,Financial Services,Sales,1
Food and Beverage Director,"MY, , ",null,70000-80000,null,"You will be responsible for directing the outlets, catering, stewarding andbanqueting operations of the hotel to make sure the accomplishment of food andbeverage quality.Also responsible for applying and developing the sales and marketing strategies ofthe catering department to give effective profitability to hotel with excellentservice and satisfaction to customer.You will manage the beverage and food operation including food preparation, cateringfunctions, food service and other lounge service.You will also be responsible for checking or observing the budget of food andbeverage, handle storage and receiving of food and beverage items.You will be responsible for hiring, recruiting, supervising and training of food andbeverage staff to obey all local, state and federal laws and company standard.Skills Required:* Budgeting, planning and controlling the financial needs. * Quality control and operational efficiency. * Ability to program design and develop. * Able to take responsibility of profit and loss. * Responsible for planning menu, promotions and events and parties. * Tracking programs for A&amp;G, A&amp;P and sales for outlets are created. * Take all the responsibility of entire operations of catering managers and foodand beverage department. * Price out of all menus for catering, room service and restaurant. * Responsible for writing programs to territory that help to know about the costof food on daily basis or on a weekly basis. * Responsible for bringing food cost and wage budgets under budget. * Responsible for cost controlling for entire food and beverage department. * Excellent communication and writing skills. * Proficient with computer literate such as Microsoft Word, Microsoft Excel,Power point and Internet. * Excellent project management skills. * Able to design program and development. * Responsible for other duties as assigned.","Computer Skills: Proficient with,* MS Outlook* MS Word* MS Excel",null,0,0,0,Contract,null,null,null,null,1
Senior Engineer,"US, , ",null,null,null,"Apply using below link#URL_1eead1e24bbaa4318ccfc699c375729468563e0ecd898e79886a53f1b51d39bf#At Puget SoundEnergy (PSE) we have a long tradition of service, and anexciting and innovative future ahead!Consider PSE for the next step in yourcareer.Senior Engineer or Below #65778Puget Sound Energy's System Planning department is looking for aSenior Engineer or below, depending on qualifications, to join ourteam! The Senior Engineer prepares engineering plans, designs,specifications, standards, cost estimates, system studies, andother such evaluations. This person will provide professionalengineering service and support in the planning, construction,operation, maintenance, and analysis of PSE transmission facilitiesand assets. This will include knowledge and analysis of theinterconnected transmission system and the applicable NERCcompliance standards that govern Transmission Planning and#URL_9d92ff4f0b9c7cbf11e3b140535ea6d7893ab636fc580cba54b74234715a9f60# role will interpret and apply existing guidelinesand engineering principles, practices, and theories toward thecompletion of assignments involving a substantial degree ofcomplexity, with many interrelated elements requiringconsiderations not previously encountered. The engineer also workson project teams to support the successful completion of projectsdesigned to reinforce the energy delivery or power generationsystems. Work on assignments is also performed with the goal ofgrowing the engineers' technical and managerial knowledge about PSEprocesses and systems. The ideal candidate supports emergencyresponse operations when needed.This is an excellent opportunity to play an integral role withinPSE to help us better serve the environment, our customers and thecommunities in which they live. PSE provides an environment whereall employees are valued, respected and provided with theopportunity to achieve maximum performance. We offer acomprehensive pay package that includes competitive compensation,annual goals-based incentive bonuses, comprehensive cafeteria-stylebenefits, 401(K), a company paid retirement pension plan and anemployee assistance and wellness program. Gain the energy to dogreat things through a career with Puget Sound Energy!PRIMARY RESPONSIBILITIES:",null,null,0,0,0,Full-time,null,null,Electrical/Electronic Manufacturing,null,1
Interviewing Now -- DirecTV Sales Representatives -- Training Class starts 11/11/2014 ,"US, TX, Corpus Christi",DTVCC,45000-67000,"Argenta Field Solutions values the client, creates income streams for them through our sales mechanism and focuses on quality &amp; numbers rather than numbers alone. While this is paramount to our foundation, the foundation itself is our people. Environment, Training and Compensation are the tripod that support our workforce. The same way we believe in quality of sales, we believe even more in quality of our people's environment, training and compensation.To setup an interview, call our recruiting department Monday-Friday from 9am-5pm @ (361) 400-2907","Interviewing Now for Sales Rep Positions -- Training class starts 11/11/2014 Football season is upon us and our Corpus Christi market requires we hire 6 new DirecTV Sales Representatives to sell HDTV satellite service. Current Sales Reps averaged $985 a week for October 2014. We pay weekly, offer management training and benefits for Managers.Positions now available in Corpus Christi TX. We provide all the tools and training to be highly successful and seek top performers to step up into leadership roles. Positions- Sales- Assistant Manager- Market Manager Compensation- $45k-$67k per year (entry level)  - Weekly pay - Direct deposit  - Bonuses (daily, weekly &amp; monthly)","- Sales experience preferred- Ability to work in high energy, team environment- Goal/Career Oriented- Strong work ethic - Professional integrity - Pre-employment screening","- AFLAC- Health Insurance (Management) - Training (Initial &amp; Ongoing)- Vacation &amp; sick time- Paid travelApply Now by contacting David @ (361) 400-2907 between M-F 9am-5pm(This is not a telemarketing or call center position)  To learn more about Argenta Field Solutions, visit our website @ #URL_1d9e75fb4100e4ecdc0d72a1205f398abb97bf07f3018745f8fbcab82dc07ef3# Argenta Field Solutions - Locations Currently Hiring711 N Carancahua St, Suite 1750, Corpus Christi TX 7840115600 San Pedro Ave, Suite 105, San Antonio TX 782323463 Magic Dr, Suite 252, San Antonio TX 782292855 Mangum Rd, Suite 417, Houston TX 770921100 E Nasa Pkwy, Suite 410, Houston TX 770589896 Bissonnet St, Suite 454, Houston TX 770362201 N Collins St, Suite 252, Arlington TX 760114101 McEwen, Suite 530, Dallas TX 75244222 E Van Buren, Suite 511, Harlingen TX 785501001 S 10th St, Suite 201, McAllen TX 785011111 Park Centre Blvd, Suite 207, Miami FL 33169 ",0,1,0,Full-time,Not Applicable,Unspecified,Consumer Services,Sales,0
