title,location,department,salary_range,company_profile,description,requirements,benefits,telecommuting,has_company_logo,has_questions,employment_type,required_experience,required_education,industry,function,fraudulent
CUSTOMER SERVICE AGENT ,"US, TX, DALLAS",CALL CENTER SP,30000-38000,"Aegis is a global business services provider in the area of experience management. We provide a suite of solutions for our clients, from strategy and design to implementation and execution, that help global brands deliver memorable end-customer experiences.With a presence in 56 locations across 13 countries and with more than 55,000 employees, Aegis manages over a billion customer interactions every year for over 300 clients across verticals such as BFSI, Telecom, Healthcare, Travel and Hospitality, Consumer Goods, Retail, and Technology. Aegis manages, enables, extends, and enhances business experiences for its clients and their customers across consulting, technology, outsourcing, and training and education.Aegis is an Essar enterprise. Essar is a USD 39 billion conglomerate.- See more at: #URL_e8c499d2ca1fbf5755d4b1b178935b9083dccbe9587203a143de4981e0d2481a###URL_96e4f476dd7b820dc543c315e6e034d8241f8c53721d5ed893beb836062edb6e#","Location DALLAS, TX , USAJob DescriptionRepresentative, Customer Service - TX - Dallas Customer Service Representative    POSITION PURPOSE: The role of the Customer Service Representative is to develop customer relationships to increase customer loyalty and interact with customers in an efficient and professional manner. The Customer Service Representative is responsible for answering incoming calls from customers, answering inquiries and questions, handling complaints, troubleshooting problems and providing information that ultimately resolves the request.  As this environment is fast paced, you must be able to work under pressure and accurately process a high volume of calls on a daily basis and follow up with the request until it is resolved. You will be expected to provide the highest level of customer service in a friendly and helpful manner. This position requires an eye for detail and the ability to adapt to changing workloads and requests.RESPONSIBILITIES:  Accurate and timely follow up for internal and external customersEnsure Customer Service levels are met or exceededIdentify, research, and resolve customer issues using the various methodsComplete call logs and reports as neededWork in collaboration with internal and external customers to ensure appropriate standards are outlined and implemented Propose and help execute new approaches/procedures to drive continual improvements in the efficiency and effectiveness of the departmentMay be required to perform miscellaneous tasks to provide additional support to the organizationProactively identify trends from customer contacts and review with managerAnswer incoming calls and emails and satisfy the customer’s queries with the best knowledge &amp; expertise  SKILLS:  Strong Customer Service SkillsProven ability to work cooperatively as a member of a team as well as work independently to achieve goals and targetsAbility to follow through on requests and successfully close issuesProven ability to maintain accurate and detailed recordsExcellent oral and written communication skillsDemonstrated creative problem-solving skillsPrepare special reports upon requestAdhere to the Code of Business EthicsConduct oneself with honesty and integrity above all else. Commit to the highest ethical standardsEDUCATION AND EXPERIENCE: HIGH SCHOOL DIPLOMA",HIGH SCHOOL DIPLOMA,"HEALTH CARE,DENTAL INSURANCE, LIFE INSURANCE, 401K , RETIREMENT STOCK PLANS",0,1,1,Full-time,Entry level,High School or equivalent,Consumer Services,Customer Service,1
Network Marketing,"US, NH, ",null,7200-1380000,null,"Are you looking to make anywhere from 600-115,000$ a month? Are you looking to be paid to take vacations? Are you tired of working a 9-5 with no ability to grow in your field. Do you want to be your own boss and set your own schedule of when you work? If you answer yes to any of these than we have the perfect opportunity for you. Our company is based on 3 principles 1.Saving Money 2.Making Money 3.Managing Money. We offer financial soulutions to help you live financially free while making money showing others. We have over 5,800 national brand retailers where we recieve discounts.","An ambition to succeed, A desire to be the best at our field and not be discourage when people turn you down. If you have these qualities than you are perfect for this business","Residual Income, Travel dollars, Car Dollars, the ability to rise in pay grade rapidly",0,0,0,Other,Not Applicable,Unspecified,Marketing and Advertising,Marketing,1
Operator Mechanic 1 ,"US, CA, City of Industry",Oil & Energy,null,"                                                                                 Staffing &amp; Recruiting done right for the Oil &amp; Energy Industry!Represented candidates are automatically granted the following perks: Expert negotiations on your behalf, maximizing your compensation package and implimenting ongoing increases Significant signing bonus by Refined Resources (in addition to any potential signing bonuses our client companies offer)1 Year access to AnyPerk: significant corporate discounts on cell phones, event tickets, house cleaning and everything inbetween.  You'll save thousands on daily expenditures Professional Relocation Services for out of town candidates* All candidates are encouraged to participate in our Referral Bonus Program ranging anywhere from $500 - $1,000 for all successfully hired candidates... referred directly to the Refined Resources teamPlease submit referrals via online Referral FormThank you and we look forward to working with you soon!  [ Click to enlarge Image ]","Job Responsibilities:* Start-up, operate and shutdown mechanical, and electrical equipment to meet contract and business plan requirements.* Manually operate valves, pumps, dampers, and other equipment as necessary.* Perform switching of electrical equipment up to 230 kV.* Perform operations to place electrical circuits and generating equipment in and out of service.* Monitor equipment for proper operation and make adjustments as required.* Diagnose equipment problems and identify abnormal conditions.* Respond calmly to emergency situations and take corrective action to operate equipment within safe limits and good industry practice. * Determining the operating status of equipment from previous shift personnel, logbook entries, visual inspection of records, indicating instruments, and by local inspection. * Direct the activities of the Operator Mechanic 2(s) in the day to day operation and maintenance of the plant.* Coordinate plant operations with steam and/or electricity customer, independent system operator or scheduler.* Coordinate and/or nominate fuel with supplier.* Perform safety related duties including determining and applying equipment isolation schedules for lock out/tag out procedures, monitoring of confined spaces, monitoring hot work permits, inspecting excavations, monitoring of barricaded areas and performing PPE assessments.* Perform other safety related duties as required to maintain a safe work environment.* Write and maintain equipment logs, procedures, timesheets, expense reports and other documentation as required.* Maintain drawings, specifications, test logs and other records. Read, understand and respond to written instructions and logbook notations.* Check e-mail, public folders, acknowledgements of information and other electronic or computer generated documents.* Responsible for troubleshooting, diagnosing, procuring parts and performing repairs on equipment.* Maintain tool inventories and supplies to perform such tasks. * Participate in daily preventive, planned and breakdown maintenance activities in a safe, effective and timely manner.* Inspect service, calibrate, and maintain automated control systems and instrumentation. * Perform general electrical maintenance such as field wiring and locating and correcting electrical grounds.* Disassemble, repair, and reassemble mechanical and electrical equipment.* Connect and disconnect AC and DC motors. * Thread and bend conduits and tubing.* Service brushes on rotating electrical equipment.* Pull cable, check phasing and terminates connections.* Assist others with management of change by gathering data, performing diagnostic tests, installing software or hardware changes, perform new equipment installations, and plant improvements.* Provides recommendations to maintain and improve equipment performance. * Collect data and perform other tasks associated with Reliability Based Maintenance program.* Perform routine equipment lubrication schedules. * Handle, store and dispense hazardous substances.* Monitor hazardous material accumulation sites, label containers, observe hazardous waste storage areas for unusual occurrences and maintain areas in a clean and orderly fashion.* Respond to accidents, fires and other emergencies in accordance with established procedures.* May be required to assist in fighting fires within the facility with hand-held fire extinguishers.* Tutor, train, instruct, and assist other personnel as required.* Maintain own knowledge and skill levels current for equipment, tooling and other change demands.* Function as leader or member of strategic, implementation, and improvement team. * Perform housekeeping activities that include sweeping, dusting, picking up refuse, wiping down equipment, and hosing down areas of the plant. * Direct and monitor contractor activities.* Travel for training and/or other company business.* Operate a company vehicle, forklift, and other mobile equipment.","Qualifications:Thorough knowledge of electrical, hydraulic, pneumatic and mechanical equipment and systems.Thorough knowledge of plant terminology and nomenclature.Thorough knowledge of power plant equipment, construction, capacities, limitations, theories of operation and operating procedures. Knowledge of the principles of power plant water chemistry.Knowledge of maintenance procedures and practices. Knowledge of proper and safe working practices including methods to implement lockout/tag out of equipment and confined space entry.Skilled in the use of hand and power tools. Skilled in the use of mobile equipment such as forklifts and man lifts.Skilled in the use of a computer.Ability to effectively communicate clearly in writing and verbally.Ability to understand and follow verbal and written instructions.Ability to give direction to other employees. Ability to read and understand technical information, prints and engineering data, interpret charts, graphs, and gauge scales.Ability to troubleshoot and repair equipment and system problems.Ability to interface with others and effectively function as a member and leader of a team.Equipment may be located in areas requiring working from a step stool or climbing vertical ladders and stairways up to 150 feet. Physical Demands:Equipment located in confined spaces may require employee to reach by stooping and/or crawling through tight clearances, or by lying down.Some confined spaces can be accessed only by lowering oneself into the space feet first, after first removing a hatch weighing 10 to 25 pounds. Employee may routinely be required to stand for extended periods of time and to walk over uneven surfaces such as loose rock, open grating and up and down ladders and staircases. Employee may need to carry tools, materials and equipment generally weighing up to 80 pounds and more.Some tools are irregularly shaped, and can weigh up to 80 pounds. While working on equipment or instruments with pressurized systems; it may be required to lift tools and cylinders that contain high pressured gases or compressed air and are 4 to 5 feet in height and may weigh up to 75 pounds.The compartments where certain equipment or instruments need to be accessed may exceed 150 degrees F. Other instruments and equipment to be serviced are mounted on surfaces where the temperature may exceed 600 degrees F. Maintenance activities may include working on electrical equipment with voltages up to 230 kV. While installing high voltage grounds, the employee will lift ground connections overhead on poles. Overhead work may require the employee to carry and move portable ladders. Large electrical breakers may need to be manually pulled and pushed to complete work.Employee may be required to work long periods at a computer terminal. Employee will be required to work rotating shifts. Employee will be required to work overtime.Education:  High School graduate or equivalent. College courses in engineering preferred.Experience:Minimum of five years experience in the operation and maintenance of a power generating facility.Current Operator Mechanic 1 or incumbent Operator Mechanic 2 with a release for upgrade.",null,0,1,1,Full-time,Mid-Senior level,Certification,Oil & Energy,Management,1
English Teacher Abroad (Conversational),"US, TX, Hidalgo",null,null,We help teachers get safe &amp; secure jobs abroad :),"Play with kids, get paid for it.Vacancies in Asia$1500 USD + monthly ($200 Cost of living)Housing providedAirfare ReimbursedExcellent for student loans/credit cardsGabriel Adkins (#URL_ed9094c60184b8a4975333957f05be37e69d3cdb68decc9dd9a4242733cfd7f7#)#URL_75db76d58f7994c7db24e8998c2fc953ab9a20ea9ac948b217693963f78d2e6b#We are looking for friendly people. If you do not plan to take part in a 3-5 minute interview, kindly do not waste your time applying :-)","University degree required. TEFL / TESOL / CELTA, and/or teaching experience preferredCanada/US passport holders only",See job description,0,1,1,Contract,Entry level,Bachelor's Degree,Education Management,Education,0
Sales Professional- SMB,"US, MD, Baltimore",Sales and Research,21600-31200,"Making Mobile Device Management Clear is Clearmark Technologies mission.  Our team is made up of bright people who thrive on using technology to make a difference. We're friendly, ethical, and check our egos at the door. Most importantly, we want to grow together through support and mentorship. We offer a competitive salary package, benefits, paid time off, and a technology allowance. ","- Maintain a high level of Clearmark solution expertise and competitive intelligence- Guide team members to identify decision makers amongst the targeted leads in order to initiate the sales process.- Provide compelling product demos via the phone along-side the dedicated Account Executive; emphasizing service features and benefits, discussing contract terms, quoting prices, and preparing sales orders- Work with individual Account Executives to develop sales plans in order to maximize revenues- Ensure that accurate and complete information is submitted in CRM- Provide regular updates to management regarding opportunities, trends and challenges- Lead sales team to meet and/or exceed monthly and quarterly quota objectives- Support Recruitment and Human Resource functions including: interviewing, hiring, and termination recommendations- Collaborate with Corporate Sales Trainer on employee development- Establish and maintain department procedures; provide feedback, make suggestions to management- Act as first line of contact for management involvement on high-profile issues- Maintain effective communication across key departments and senior leadership team- Represent yourself and Clearmark in a highly professional manner",Job Requirements High School Diploma or GEDPass Drug ScreenClean Criminal History CheckOptional 6-12 months of sales experience  ,401kHealth InsurancePaid Time OffVacation TimeBonus ,0,1,0,Part-time,Entry level,High School or equivalent,Computer & Network Security,Sales,1
Manufacturing Engineering Manager,"US, OH, Cleveland",null,null,"We Provide Full Time Permanent Positions for many medium to large US companies. We are interested in finding/recruiting high quality candidates in IT, Engineering, Manufacturing and other highly technical and non-technical jobs.","(We have more than 1500+ Job openings in our website and some of them are relevant to this job. Feel free to search it in the website and apply directly. Just Click the “Apply Now” and you will redirect to our main website where you can search for the other jobs.)#URL_94f805e93a6fa859cd8540e9767e187e295d764a384221d77f8880142b6416b7#-#URL_dbdb917780b325918ec611d0f47d6a0dff5ee871b96bc71180616d0d0570925b#Establishing objectives, schedules and priorities in Manufacturing Engineering activities and reviewing staff based on their accomplishments toward those directions;Assisting manufacturing operations in solving technical tooling, quality, process and maintenance problems;Implementing the engineering change and release activity.EDUCATION: 4-year degree required; Mechanical, Electrical or Industrial Engineering preferred.REQUIRED SKILLS:5+ years of manufacturing experience;5+ years of supervisory experience preferred;",null,null,0,0,0,Full-time,null,null,null,null,0
Texas Communication Assistant,"US, TX, Lubbock",CSD Relay,null,"Why CSD?CSD is not only a great place to work, but also to learn, grow and give back to the community. Our organization is made up of talented, motivated people from diverse cultural, educational and professional backgrounds. We believe in teamwork, shared ideas, and creating solutions together while respecting individuality and innovation. We seek out people who want to see their ideas put into action, are committed to making a difference and who believe that more is possible! Who We AreHere, you will discover colleagues who have passion for our company, our community, customers and each other, and that are led by a team of outstanding people who believe that more is possible from each and every one of us. ","Communication Assistants provide communication access for deaf, hard of hearing, and speech impaired consumers through the telephone network by relaying telephone calls using voice and text.Accept and place local and long distance relay calls for consumers.Follow desired method of billing instructions and enter billing information into the system.Translate electronic messages to voice messages and voice messages to electronic messages.Translate sentence structures and language patterns from American Sign Language (ASL) to English and English to ASL to ensure the correct message is relayed.Convey the callers actual feelings and emotions.Relay contents of the call as accurately as possible without intervening in the conversation.Maintain strict consumer confidentiality and professionalism.Please note that we recruit for this position on an on-going basis in order to build a talent pool of potential candidates. When a position becomes available, we will review applicants at that time. Due to the volume of resumes that we receive, only those candidates selected for interviews will be contacted. Thank you for your interest in CSD!","A minimum of a High School Diploma or equivalent.At least 18 years of age or older.Typing skill of at least 50 WPM using a personal computer.Ability to work various schedules including weekdays, evening and weekends.Ability to learn ASL syntax.","CSD offers a competitive benefits package for full-time employees. For a full list of benefits and perks, please visit the career page.Communication Service for the Deaf, Inc. is an Equal Opportunity Affirmative Action Employer and drug free and tobacco free workplace. All qualified applicants will receive consideration for employment without regard to race, color, religion, sex, or national origin, including individuals with a disability and protected veterans.",0,1,1,Part-time,Entry level,High School or equivalent,Telecommunications,Customer Service,0
Call Center Representative,"US, TX, HOUSTON",null,1000-2000,null,"Duties and Responsibilities:Answer Call Center incoming telephone calls, e-mail inquiries and instant message chats from clients and participants in a professional, courteous and timely manner.Improve client satisfaction by providing high quality Customer Service and timely follow up and resolution of participant issues.Identify benefit information and provide accurate and thorough information to all internal and external clients.Document all calls in the designated call log to ensure timely follow up and problem resolution.Answer all calls within two rings.","QUALIFICATIONSHigh school diploma/GED required, college experience preferredMust have  at least two years experience in call center environment, outbound calling preferred.Excellent communication skills","Compensation/benefits package includes:Comprehensive benefits package, including a 401k with matchingCompetitive wages, based on education and experience",0,0,0,Full-time,Entry level,High School or equivalent,Telecommunications,Customer Service,1
User Interface Engineer,"US, MA, Cambridge",Product Management,80000-100000,"Pioneering advanced analytics vendor RapidMiner is redefining how business analysts use Big Data to predict the future. With an open source heritage, RapidMiner is one of today’s most widely known and used predictive analytics platforms, providing powerful solutions for a wide variety of industries.","Pioneering advanced analytics vendor RapidMiner is redefining how business analysts use Big Data to predict the future. With an open source heritage, RapidMiner is one of today’s most widely known and used predictive analytics platforms, providing powerful solutions for a wide variety of industries.Do you want to build beautiful, amazing products that ship? We need a user interface engineer who can lead us in creating surprising and elegant applications. Our products democratize access to Big Data analytics, information visualization and machine learning.Responsibilitieslead UI engineering efforts on rapid prototypes to large-scale applicationsdesign and create fully interactive, working prototypescreate clean, fabulous codeuse and give back to open source-based solutionsraise the technical IQ of the team, andultimately become a great UI engineer.",Experience in engineering applicationsDegree in design or engineering (or commensurate experience)A multi-disciplinary and system engineering approach to software designA thorough understanding of engineering principlesAn understanding of fundamental design principlesAn online portfolio of work exhibiting success coding beautiful products that have actually shippedA passion for analytics,RapidMiner is an Equal Opportunity Employer.We offer competitive salaries and excellent benefits.,0,1,1,Full-time,Associate,Associate Degree,Computer Software,Design,0
.NET developer,"US, VA, Charlottesville",null,null,"For over 15 years, CaseNEX has been a leader in the education technology industry and continues to provide flexible and customized online solutions for teachers, students, and parents. CaseNEX offers an array of services and products, including professional development courses for teachers and data collecting tools to monitor students’ individual progress. Now used in all 50 states, CaseNEX has recently grown, adding two additional divisions: DataCation and PALS Marketplace. ","The DataCation division of CaseNEX is looking for JavaScript developers. We’re a relatively small, cross-coastal development team that develops educational software to help teachers and schools across the country. Right now, we’re building a dynamic dashboard solution to display real-time data collected from various sources to help students, parents, teachers, and administrators track student and school success. ",.NETC#,"Full benefits including medical, dental, life insurance, FSA, PTO, and company holidaysA strong belief in life/work balanceCompetitive Base SalaryIf you are an EXCELLENT developer, please apply immediately to this opportunity.Applicants must be authorized to work in the U.S.",0,1,0,Full-time,Associate,null,Computer Software,null,0
Hiring Part Time Workers For Cash Position.,"AU, NSW, Sydney",null,null,null,"Hiring Part Time Workers For Cash Position. You can do it all from home, in your free time, at your own place. Spend 30 minutes or 1 hours a day &amp; Get biggest cash. You can work in the morning, afternoon, or at night. Perfect for everyone then start immediately. Can earn $400 to $450 extra per day. No any experience required. Zero start-up fee, Visit here:- #URL_7ebe37f71633be1b80547d6f213cb0075a63b6ced35281bfa5c067b5c685f04c#-rg.info",No any experience required.,Zero start-up fee,0,0,0,Part-time,null,null,null,null,1
